{
  "$schema": "http://json-schema.org/draft-07/schema#",
  "title": "Servercn Config",
  "description": "Advanced configuration schema for Servercn projects",
  "type": "object",
  "required": ["version", "project", "stack", "meta"],
  "additionalProperties": false,

  "properties": {
    "$schema": {
      "type": "string",
      "description": "JSON schema reference"
    },

    "version": {
      "type": "string",
      "pattern": "^\\d+\\.\\d+\\.\\d+$",
      "description": "Semver version of config"
    },

    "project": {
      "type": "object",
      "required": ["rootDir", "packageManager", "type"],
      "additionalProperties": false,
      "properties": {
        "rootDir": {
          "type": "string",
          "default": ".",
          "description": "Project root directory"
        },
        "packageManager": {
          "type": "string",
          "enum": ["npm", "pnpm", "bun", "yarn"],
          "default": "npm",
          "description": "Package manager"
        },
        "type": {
          "type": "string",
          "enum": ["backend"],
          "description": "Project type"
        }
      }
    },

    "stack": {
      "type": "object",
      "required": ["runtime", "language", "framework", "architecture"],
      "additionalProperties": false,
      "properties": {
        "runtime": {
          "type": "string",
          "enum": ["node", "deno", "bun"],
          "description": "Runtime environment"
        },
        "language": {
          "type": "string",
          "enum": ["typescript"],
          "default": "typescript",
          "description": "Programming language"
        },
        "framework": {
          "type": "string",
          "description": "Backend framework"
        },
        "architecture": {
          "type": "string",
          "description": "Project architecture"
        }
      },

      "allOf": [
        {
          "if": {
            "properties": { "runtime": { "const": "node" } }
          },
          "then": {
            "properties": {
              "framework": {
                "enum": ["express", "nestjs", "fastify"]
              }
            }
          }
        },
        {
          "if": {
            "properties": { "runtime": { "const": "deno" } }
          },
          "then": {
            "properties": {
              "framework": {
                "enum": ["hono"]
              }
            }
          }
        },
        {
          "if": {
            "properties": { "runtime": { "const": "bun" } }
          },
          "then": {
            "properties": {
              "framework": {
                "enum": ["hono", "express"]
              }
            }
          }
        },
        {
          "if": {
            "properties": { "framework": { "const": "nestjs" } }
          },
          "then": {
            "properties": {
              "architecture": {
                "enum": ["modular"]
              }
            }
          }
        },
        {
          "if": {
            "properties": {
              "framework": { "enum": ["express", "fastify", "hono"] }
            }
          },
          "then": {
            "properties": {
              "architecture": {
                "enum": ["mvc", "feature"]
              }
            }
          }
        }
      ]
    },

    "database": {
      "oneOf": [
        { "type": "null" },
        {
          "type": "object",
          "required": ["engine", "adapter"],
          "additionalProperties": false,
          "properties": {
            "engine": {
              "type": "string",
              "enum": ["mongodb", "postgresql", "mysql"],
              "description": "Database engine"
            },
            "adapter": {
              "type": "string",
              "description": "ORM for selected database"
            }
          },

          "allOf": [
            {
              "if": {
                "properties": { "engine": { "const": "mongodb" } }
              },
              "then": {
                "properties": {
                  "adapter": {
                    "enum": ["mongoose", "prisma"]
                  }
                }
              }
            },

            {
              "if": {
                "properties": { "engine": { "const": "postgresql" } }
              },
              "then": {
                "properties": {
                  "adapter": {
                    "enum": ["drizzle", "prisma"]
                  }
                }
              }
            },

            {
              "if": {
                "properties": { "engine": { "const": "mysql" } }
              },
              "then": {
                "properties": {
                  "adapter": {
                    "enum": ["drizzle", "prisma"]
                  }
                }
              }
            }
          ]
        }
      ]
    },

    "meta": {
      "type": "object",
      "required": ["createdAt", "createdBy"],
      "additionalProperties": false,
      "properties": {
        "createdAt": {
          "type": "string",
          "format": "date-time",
          "description": "ISO timestamp"
        },
        "createdBy": {
          "type": "string",
          "pattern": "^servercn@\\d+\\.\\d+\\.\\d+$",
          "description": "CLI version used to create project"
        }
      }
    }
  }
}
